Jasmine,14,"I: You've just done one collage yes [how I see myself]? 
J: Yeah. 
I: Can you explain to me why you've used 
these pictures and what they represent? So 
can we start with the flower? 
J: I like to smell flowers so that's why I 
put the picture there, and I have ‚respect' 
[word]. I think I'm pretty. 
I: You've used Mariah Carey for that? 
J: Yeah. 

I: Do you think Mariah Carey is pretty? 

J: Yeah. 

I: And what about the lips? 

J: I like make-up. 
I: You like mak e-up. 
J: Yeah. 

I: Now you've not anything on how you think other people see you, why is that? 

J: I didn't have time to finish it. 

I: If you did have time more time to work on it, do you think that both sides would be 
the same or do you think that they would be different? 
J: Not the sa me. 

I: What type of differences would there be? 
(pause) Like what types of things do you 
think other people might see y ou as that you think, that isn't how I really am// 
J: //quiet. 

I: Quiet. 
J: Yeah. 
I: What else? (long pause, Jasmine shrugs) You can't think. 

J: Mmm. 

I: You've put Mariah Carey there do you 
think other people think you're pretty ? 
J: Some people. 
I: Like who? 
J: Um (long pause, no response given). 



 
323
I: OK, and just finally how 
would you usually describe y
our ethnicity? What would 
you usually say? 
J: I'm Indian. 
I: Were you born in this country though? 
J: Yeah. 

I: But yo u'd say I'm Indian? 

J: Yeah. 

I: Always? 

J: Yeah. 
I: Do you ever say I'm British or do you ev
er say that I'm British Asian or do you 
always say I'm Indian? 
J: Indian. 

I: You say you're Indian. Is it important for 
y ou to let people know that y ou are Indian? 
Like do you get annoyed if people call you Pakistani? 
J: Yeah. 
I: Why? 

J: I don't know. 

I: OK, thanks. 

 
(G=Ghazal, aged 13, female; I=interviewer) 


I: You've done two little collages, so let's st
art with ‚how I see myself'. Do you want 
to explain what images you've used and why you've used them? 
G: Yeah I used a dog and a person and a pe
rson holding a dog because like to show that 
I'm kind of caring like that, I've done a 
chocolate I've done that 'cause I love 
chocolate. 
I: OK. 

G: I've done McDonald's like chips and 
burger for McDonald's, I like going to 
McDonald's and eating their 
burgers, and I've done a la
dy with a big smile I done 
this because that shows I'm alway s happy . 
I: So let's go onto how you think other people
 see you. You've just used a picture again 
of a lady smiling. Is that the same, because people see you're happy// 
G: //yeah people see me as happy. 

I: And what about the watch, what does that represent? 

G: When I went through the magazine I found this watch then I thought that's a bit 
fashionable. 
I: Do you think there's a difference between how you see yourself and how you think 
other people see you? 
G: Not that much. 

I: So where would the differences be? 

G: Um. 
I: Like do you think there's any thing about how you see y ourself that y ou think other 
people just don't see// 
G: //no not really. 

I: So y ou don't think there's a difference? 

G: No. 

I: And just finally how would y
ou usually describe y our ethnicity ? 
G: Whenever they [other people] ask me 
I say Turkish ' cause my parents are fr om 
Turkey and I don't really say British or something like that. 
I: So were y ou born over here? 

G: Yeah. 

I: You were born over here but you say// 
G: //I say I'm Turkish. 
I: Why is it important for you to say I'm Tu
rkish instead of saying I'm British or I'm 
English? 



 
324
G: So that people can exactly know where I'm 
from and like what place of the world I'm 
from and that's all. 
I: So do you iden tify mo re with being English or with being Turk ish? 
G: Turkish. 
I: Turkish. 

G: Yeah. 

I: OK that's brilliant. 

 

(D=Daniya, aged 13, female; I=interviewer) 

I: You've done two collages so let's start with
 ‚how I see myself'. Can you just explain 
what the images mean to you, what you're trying to express with them? 
D: Well that one, the top one// 

I: //the baby // 
D: //the baby means that I' m caring. The 
ring and watch means that I like shopping for 
things that suit me and I'm fashionable and 
yet I'm also into fashion, and the make-up 
I like wearing make-up kind of thing. The girl who is like smiling looks like she's 

shy so someti mes I' m shy and stuff, and that
 one's [image of a brown haired woman] 
happy I'm mostly happy. 
I: OK and what about on how you think other people see you because you've just used a 
picture of one lady and a bird. 
D: The bird makes you feel like I'm really, you know birds they fly off everywhere innit 
and they're adventurous and like people thi
nk I'm really adventurous just like my 
friends think that and like, like I don't know how to explain but like they think I'm 

loud like I speak a lot I say all my feelings out. 
I: Who is this lady? 
D: It's just a lady who, who's like, she's st
icking her head out kind of like, she's like, I 
can' t explain it well. 
I: She's quite proud// 

D: //proud, yeah confident, confident. 
I: And that's how you think other people see you// 
D: //other people see me. 

I: But do you feel proud and confident and like you can speak your own mind? 

D: No. 

I: But you think other people see you as quite a confident person? 

D: Yeah. 
I: So do you think that there's a differenc
e between how you see yourself and how you 
think other people see you? 
D: Yeah 'cause I'm not really adventurous like going off to places and, and. 

I: And other people think you're 
a lot mo re confident and assertive// 
D: //yeah// 
I: //and maybe a stronger person than you actually feel that you are// 
D: //yeah, yeah, I'm like shy and quiet. 

I: OK and just finally how would you usually describe your ethnicity? 

D: I would describe myself as Pakistani like. 

I: You would say Pakistani? 

D: Yeah 'cause that's my culture and like 
my parents were brought up there like I was 
brought up here but still I respect my faith. 
I: So is it important to you to say I'm Pakistani? 

D: Not really. 

I: But then why do you say it? 

D: 'Cause, 'cause when peop le see me th ey
 think that I'm Pakis tani 'cause I look 
Pakistani yeah and stuff but I call myself like both like British and Pakistani, 'cause 
like I was brought up here and I speak this language, but also for one or two years I 

was brought up there and speak that language so. 



 
325
I: But when people ask you, you do usually say I'm Pakistani? 
D: Yeah. 

I: You do? 
D: Yeah. 
I: Is there one that y ou feel more than 
the other? Do you feel more British than 
Pakistani or more Pakistani than British// 
D: //more Pakistani. 

I: You feel more Pakistani than British? 

D: Yeah. 
I: OK thanks.",6736,19,19.0,"Self-Perception, Others' Perception, Differences in Perception, Emotional Expression",0,0,0,0,0,0,0,1,0,0,1,0,0,0,0,0,0,0,0,0,0,0,0,0,0,0,0,0,1,0,0,0,0,0,0,0,1,0,0,0
Amira,13,"I: OK Amira you've done two collages, so let's start with ‚how I see myself'. Do you 
want to explain what pictures you've used and why you've used them? 
A: I've used that [image of blue colour] 
'cause I think I'm a bit, I'm in a good mood at 
times and the grey like I can be a b
it horrible when I'm in the mood. 
I: OK. 

A: And there's a heart because I'm caring and that is [image of a bank] because I like the 
music and, I don't know. 
I: What about that, is it a rapper? 

A: Yeah, Snoop Dog. 

I: Why have you used Snoop Doggy Dog? 

A: He's good at rap and stuff and I'm always
 writing and alway s like thinking about new 
stuff to write. 
I: Let's move onto how you think other pe
ople see you. You've just used the word 
‚glamorous' and a picture of a baby, what do they// 
A: //people think of me like cute and glamorous and I look nice and I can be caring at 
times. 
I: OK// 
A: //but I also look like an ordinary person and happy. 
I: You've just said that you think you look like an ordinary person, but it is also very 
obvious that you are religious because you are wearing a headscarf// 
A: //yeah// 

I: //do you think that people think about that when they see you? Do you think they 
might look at you and think she's Muslim or do you think that isn't what they see 
first? What do you think that they see? 
A: Yeah I think they do see that I'm Mus
lim because of my headscarf and the way I look 
and that but I'm not really sure. 
I: Do you think when people look at you then that they see the headscarf as a good thing 
or a bad thing? 
A: They see it as a good thing 'cause they know th at I'm religious and you're part of 
your religion and you know what your religion is about. 
I: So you think that when people 
see that that's a positive thing? 
A: Yeah. 

I: Do y ou think there are any differences between how you see yourself and how you 
think other people see you? 
A: Um. 
I: Not just from what you've done but what y ou think. 

A: Um (long pause), I don't know. How do you mean, how other people think of me? 

I: Yes. (pause) Do you think they have an
 impression of you, like when they see you, 
that is maybe not how you see yourself? 
A: Yeah, but they might have a different opinion to me as in that I can be horrible at 
times but other people might think that I can't be because I'm Pakistani but I can be 

kind and caring and stuff like that, that's what I think. 



 
326
I: And just going back to ‚how I see myself'.
 Your religion is obviously important to 
you because you do wear the headscarf, but you've not put anything about that under 

how you see yourself. 
A: I don't really see myself 'cause, I don't really see myself as religi ous 'cause I don't 
really do I always have stuff yeah. 
I: So it's just so normal, who you are, you don't think about it? 

A: Yeah I don't really think about it 'cause I don't, OK it is important to me like that. I 
don't think of what others, not like one of the main that I think about it a lot. 
I: Right. And just finally how you would usually describe your ethnicity? 
A: Asian or Pakistani. 
I: What one would you usually use? 

A: I'd say Asian, I'm an Asian. 

I: You would say Asian, or Pakistani sometimes? 

A: Yeah. 
I: So when would you say Pakistani and when would you say Asian? 
A: If people ask me as in like where do your 
parents come from and like what culture 
you are I always say yeah I'm Pakistani but like if somebody, like if people look at 

me and say what type of race and stuff are you I say that I'm Asian and stuff. 
I: Were you born over here though? 
A: Yeah I'm British Asian. 
I: But do you always say British Asian? 

A: No I don' t. 

I: Do you identify with British or do you identify with being Asian? 

A: I would say Asian, I'm just an Asian. 

I: That's what you identify with most? 
A: Yeah. 
I: Yeah? 

A: Yeah. 

I: OK that's brilliant. 

 
(H=Henry, aged 13, male; I=interviewer) 


I: You've just done one collage yes// 

H: //yeah// 

I: //‚how I see myself'. Do you just want to 
explain to me why you've used each of the 
pictures, what you are trying to express about yourself with them? So let's start with 
the mobile, why did you use the mobile? 
H: Because I, I like it. 

I: You like the mobile. 

H: Yeah. 

I: OK and what about, you've got pictures of cars. Why did you use pictures of cars? 
H: Becaus e I like cars and I like racing. 
I: So if I was going to use some words to describe the type of person that you see 
yourself as, how you see yourself, what words would you use? 
H: Um. 

I: Like do you think you're loud, angry,
 fun or hard-working or, how do you see 
yourself? 
H: I think like hard-working and not loud. 
I: Not loud. 

H: No. 

I: So quiet. 

H: Yeah. 
I: Now you didn't do anything on the other side, do you think that when other people 
see you// 
H: //yeah// 



 
327
I: //do you think the way they see you is th
e same way as how you see yourself? (pause) 
Like when they look at you do you think that they see someone who is quiet? 
H: Yeah. 
I: You do. 
H: Yeah. 

I: Do you think that other people might think something, like they might think 
something about what type of person you are that you don't feel you are? 
H: Yeah. 

I: Like what? 
H: I don't know. 
I: And just finally I asked you about your ethnicity and you said Bulgarian. 

H: Yeah. 

I: Were you born here or were you born in Bulgaria? 

H: In Bulgaria. 
I: You were born in Bulgaria. 
H: Yeah. 

I: So how long have you been here? How many years or months? 

H: One and seven. 

I: Nearly two years? 
H: Yeah. 
I: Do you say you are Bulgarian or do you think that you are British? What one do you 
feel more? 
H: Bulgarian and British. 

I: You feel both? 

H: Yeah. 
I: What are the differences, do you think ther
e is a difference between being Bulgarian 
and British? 
H: Yeah. 

I: What's the difference? 

H: I like my country more, and I like it more here. 
I: So do you miss your country? 
H: No not that much. 

I: You don't miss your country that much, but it's important for you to say you are from 
Bulgaria so people know where you are from? 
H: Yeah. 

I: OK that's brilliant. 



 
328
Appendix B.3: Millbrook Community School
 
 
(D=David, aged 13, male; I=interviewer) 


I: So let's start with your collage David. Do you want to just explain what pictures 
you've used on the ‚how I see myself' side 
and what they mean to you, what they 
represent? 
D: OK I've got a picture of Gordon Brown who is like the Prime Ministers PA or 
whatever it is, and he wants someone dead he wants to be// 
I: //he wants who dead? 

D: Tony Blair. 

I: OK. 
D: I've got a picture of Tony Blair 
because he's like all powerful like me. 
I: In what way do you think you're powerful? 

D: My voice. I'm very opinionated. 

I: Why? 

D: Because, because// 

I: //do you think Tony Blair is opinionated? 
D: Sort of, but he lies a lot as well. 
I: He lies a lot. 

D: Yeah. 

I: About? 

D: Policies. 
I: So do you think he's a good figure or a bad figure? 
D: Probably a bad one. 

I: But that's part of how you see yourself? 

D: Yeah. And this little assassination guy he
re has some, load of guns, I'm gonna grow 
up to be a murderer. 
I: A murderer? 
D: M mm. 

I: What about the puppy though and the heart and the penguin, because they're quite 
soft compared to the other images? 
D: The penguin is just my favourite animal so. 

I: Why is it your favourite animal? 
D: Don't know, just is. And the little ‚break my
 heart' [words] thing, I don't know why I 
put it on there I just kind of stuck it on there. 
I: Does it mean anything to you? 

D: No. And the little puppy just, that's just I've got dogs. 

I: That you've got dogs? 
D: M mm. 
I: And what about the ‚touch' [word]? 

D: It's all shiny and stuff like that so, y eah it's kind of loud. 

I: Loud? 

D: Yeah. 

I: Does the word touch represent anything 
for you? Is there a reason why you chose 
that word? 
D: No. 

I: So it was the shininess? 

D: Yeah. 

I: Let's move onto ‚how I thi
nk other people see me'. Let's start off with the image of 
the tiger, the fly and the eagle. What do they mean? 
D: The little tiger means, I don't know, free and loud and you know do what you want to 
do. And the crazy wacky fly thing represents madness and freaky looking. 
I: Freaky looking ? 



 
329
D: Yeah, and mad. 
I: What about the eagle? 

D: The eagle represents freedom. 
I: Freedom? 
D: Yeah and you know same as the tiger really. 

I: OK and what's this image [i
mage of a little monkey ] here? 
D: It's a monkey. 

I: A monkey. What does a monkey mean to you? 

D: It represents my Chinese year, monkey, the year of the monkey. 
I: And we've got Dracula here. 
D: Dracula represents kind of like evil. 

I: What was that? 

D: Evil. 

I: Evil in what way? 
D: Because I can be really sound, but then if someone gets on the wrong side of me I can 
be nasty and evil. 
I: You can be sound but// 

D: //yeah, but then if they get on the wrong side of me I can be evil. 

I: You've also got the word ‚wild' here four times why is that? 
D: I don't know, just wild, it just wild. More wild. 
I: Now I've noticed on this side, on how you think other people see you, you've 
actually used quite a lot of i mages from 
nature, like animals. Why is that? 
D: I've just always liked nature so you k
now, like animals have a lot in common with 
people really don't they personality wise. 
I: Animals have a lot in common with people personality wise? 
D: Yeah. 
I: Do you think there's a difference between how you think other people see you and 
how you see yourself? 
D: A bit yeah but then// 

I: //in what way? 
D: Because like, I don't know really just, I don't know. 
I: Because here [how I think other pe
ople see me] you've put down evil and quite 
freaky and wild. Do you think they are positives, that they are good things that 

people see in you, or do you think that people see them as bad things? 
D: People, some people may see them as bad things and some people may see them as 
good because like maybe like the teachers a
nd stuff see me, you know, like as wild or 
something like that, see me as bad and stuff like 
that but really I'm just a kid trying to 
have some fun and they don't understand that so. 
I: If you had more time are there any extra pictures that you would have put on your 
collage? 
D: Yeah. 
I: Like? 
D: Loads. 

I: Such as? 

D: Just some different pictures of, maybe some more animals and stuff like that. 

I: And just one more thing, I noticed on how you see yourself you've put down a 
picture that you said represented mu rder. 
D: Yeah. 
I: Why do you see that as part of how you see yourself? 

D: Because, like, because sometimes I get really
 angry and stuff like that and I feel like 
killing people like Richard [pupil]. 
I: OK, just one more question, how would you describe your ethnicity? 
D: British. 
I: Is that how you always describe your ethnicity? 

D: Yeah. 



 
330
I: That's excellent. Thank you.",10981,20,20.0,"Self-Perception, Others' Perception, Cultural Identity, Emotional Expression, Hobbies and Interests, Fashion and Trends, Self-Identity Conflict, Familial Relationships, Emotional Complexity, Celebrity Influence, Perception of Differing Sides of Personality, Identity and Self-Perception, Disconnection from Cultural Expectations",0,0,1,0,0,0,1,0,1,1,1,0,0,0,1,0,0,0,1,0,1,0,1,0,0,0,0,0,1,0,1,0,0,0,1,0,1,0,0,0
Richard,13,"I: Richard, let's start with ‚how I see my
self'. Do you want to discuss the images 
you've chosen? 
R: I have an image of some fashionable people because to mysel f I think I'm very 
fashionable. I also have a picture of something saying ‚I want a f***ing baby' 

[words] because it' s funny and I see myself as a humorous person (laughter in room). 
I: What about the Brad Pitt head? 
R: I think I resemble Brad Pitt in many ways 
and the body that I have there I think is 
exactly the same except mine has a few mo
r e packs on there (laughter in room). 
I: Right. Thinking about this side, a
bout how you see yourself, now I know you'v e 
been laughing but are these things that you genuinely think you are, or are they things 
that you aspire to, that you want to be like that? 
R: Well David [pupil] told me to say yes to that I think I am, but I think I aspire. 

I: You aspire to// 

R: //except that one. 

I: Except the humorous one. 
R: Yes. 
I: So inside you aspire to be fashionable and have a body like that and look like Brad 
Pitt? 
R: Yes. 

I: OK let's move onto this side ‚how I think ot
her people see me'. Would you like to go 
through the images here? 
R: Well I have a picture of Matt Lucas on one of his sketches of Andy [
Little Britain
 
character ] the matey in the wh
eelchair because I think people find me quite funny at 
times. Also have some words saying ‚lots on his plate' because I think people see me 

as fat. I also have a picture of Dafydd Thomas [
Little Britain
 character] because he's 
gay and people so metime s see me a s ga y. I have a p icture of Kat Slater [
EastE nders
 
character] because she's feisty and people think I'm feisty, and then I have a picture 
of Hitler because people think I am cruel at times to certain people. 
I: And you've also written in the middle. What does this say? 

R: ‚Me, myself and I' and ‚King Richard'. 

I: Now looking at your collage there's quite a difference between this side [how I think 
other people see me] and how I see myself. What do you think on the whole people 
see you as? 
R: Um. 

I: Do you think they have a high opinion of you or a negative opinion? 

R: A bit of both, it depends on who it is. Some people have a low opinion. 

I: Such as who? 
R: People like Prateech, Han nah Pond [pupils] 
and people I don't like, and some people 
such as David [pupil] has a positive image about me. 
I: And you've also used images of women to show fashionable [how I see myself]. 

R: Yeah. 

I: Why did you choose to women and not images of men? 

R: Because I couldn't find any men that looked fashionable. 
I: You couldn't find any men that looked fashionable? 
R: No. Not like that anyway (laughing). 

I: Also the Hitler image and ‚cruel at times' [words], wh en can you be cruel? Or do you 
feel you're a cruel person? 
R: Sometimes to Hannah Pond [pupil] yes because we don' t get along so I quite a lot 
cruel to her and she's cruel back. To Prateech [pupil], I admit I will admit I am a bit 
racial to him at times I have been. 
I: Why are you racist to him? 



 
331
R: I don't know I've just been like, if I've b
een sat next to him I've said to David [pupil] 
before he smells or curry or something 
just mucking around which, if you think about 
it you know it is out of order but at the time it was just a funny thing to say but it 
doesn' t mean anything. 
I: OK. If you had more time to work on 
y our collage are there an y more pictures tha t 
you would have liked to have put on there? 
R: Yes, I would have put a picture of Martin Luther King. 

I: Why? 

R: He was a hero because he stood up for what he believed is right. 
I: And which side [of the collage] would you have put that on? 
R: In the middle. 

I: In the middle? 

R: Yes. 

I: And what else? 
R: I cannot think at the mo ment, I can only think of Martin Luther King. 
I: Also, how would you usually describe your ethnicity? 

R: Richard come from China (mimicking Chinese accent). 

I: Why do you say Chinese? 

R: Because it's funny (mimicking Chinese accent) . 
I: Where are your parents from? 
R: British, Britain (mimicking Chinese accent). 

I: They are both British? 

R: Yeah (mimicking Chinese accent). 

I: But you say Chinese? 

R: Yeah (mimicking Chinese accent). 
I: And you say Chinese because? 
R: It's funny (mimicking Chinese a ccent). 

I: It's funny? 

R: Yeah (mimicking Chinese accent). 

I: So you regard being Chinese as being f
unny? You think being Chinese is funny? 
R: I think if teachers s ay where come from I'll always say Chinese and put on an accent 
because I think it's funny at the time. 
I. OK, thank y ou. 

 

(D=Dan, aged 13, male; I=interviewer) 


I: So Dan, could you start with ‚how I see my
self' and just explain what images yo u've 
used and why? 
D: I've used, um// 

I: //what's this an image of? 

D: PlayStation portable because I like playing like games and on PlayStation. 
I: And yo u've also got an image of an eagle there. 
D: Because I'm not like, I don't really talk much but I normally just watch so. 

I: So you don't really talk much and you just observe// 

D: //yeah. 

I: So is that why you've got the word ‚quiet' there? 

D: Yeah, quiet. 
I: Now let's go onto ‚how I think other peopl
e see me'. You've not used any images 
you've only got the words ‚quiet' and ‚tall'. Why is that? 
D: Because probably people don't really know me that much because I don't speak 
(pause). 
I: Let's move back to ‚how I see myself'. 
If you could have put more images on this to 
express how you see yourself what types of things, if you had more time, would types 
of things would you have put down? 
D: Um (long pause), I don't know. 



 
332
I: Because so far all I can see is that you like
 PlayStation and that you're quiet and that 
you observe. Is there any more to how you see yourself? 
D: (long pause) I don't know. 
I: You don't know? 
D: (long pause) No. 

I: And just finally how would y
ou usually describe y our ethnicity ? 
D: English. 

I: OK, thanks Dan.",6000,21,21.0,"Self-Perception, Others' Perception, Emotional Expression, Celebrity Influence, Role Models, Differences in Perception",0,0,1,0,0,0,0,1,0,0,1,0,0,0,0,0,0,0,0,0,0,0,0,0,0,0,0,0,1,0,0,0,0,1,0,0,1,0,0,0
