Kate,13,"I= Have yo u just done on e collage? 
K: Yeah this is all I've done. 
I: Do you just want to go through the pictures and explain why you've used them and 
explain what they represent about how you see yourself? 
K: OK well I chose Mr Potato Head [toy char
acter] because I find myself really funny, I 
chose a really colourful bird because I'm 
colourful, I chose a glass of champagne 
because I think myself very bubbly and I cho
se like the necklace with an ‚A' on it 
because I think I'm an angel and I chose that
 one, the one with the two frogs, because 
it's got loads of colours and colourful like me. 
I: If you had more time to work on this, do you think how you see yourself and how you 
think other people see you are the same or would they have been different? 
K: I think that side [how I think other 
people see me] would have been different. 
I: In what way? 
K: It would have different things on it because some people think different things and 
others. 
I: Like what sort of things would you have put on there? 

K: Well I tried to get someth ing to represent annoying because my mum thinks I'm 
annoying. 
I: What sort of things, or what would you use to represent that? 

K: I don't know. 

I: And just finally, how you would usually
 describe your ethnicity? (long pause) 
Because you wrote down that your ethnicity was other black background, but if 

somebody asked you what would you say? 
K: Erm, English. 
I: So would you say you're English? 

K: Yeah. 

I: Would you always say that? 

K: Yeah. 
I: OK brilliant. 
 

(Q=Queenie, aged 13, female; I=interviewer) 



I: Do you want to go through the pictur
es on how you see yourself and explain what 
they represent? 
Q: Well I've used that phone one because I'm 
always on the phone and I'm really chatty 
and everyone says I'm really chatty and then I used that picture [i mage of Raven 

Baxter] because I always watch TV, and that music one I like music and I always 

watch it so. 
I: You've got a picture of Jessica Simpson, why have you used a picture of her? 
Q: She's quite fashionable and I like clothes and stuff. 
I: Is it her fashion that you like or is there anything else about her that you like? 

Q: Just her fashion really . 



 
361
I: Just her fashion? 
Q: Yeah. 

I: And you've also got a picture of, is that Kylie Minogue? 
Q: Oh no, it's the candle. 
I: So it's not Ky lie Minogue, it's just the candle? 

Q: Yeah. 

I: What are you trying to say with the candle? 

Q: I used the candle because I'm really relaxed. 

I: You've got coffee there as well, why is that there? 
Q: Just like beca use I'm alwa y s li
ke wide awake, I like coffee so. 
I: So you think you're quite an alert person? 

Q: Yeah. 

I: OK now on how you think other people see you you' ve not got much apar t from 
‚Daddy's Girl' [words], what is that? 
Q: Oh it's just a little stic
ker that says Daddy's Girl. 
I: So is that how you think other people see you? 

Q: Yeah my mum thinks I am because I always go to him for stuff. 

I: Do you think there's a difference between how you see yourself and how you think 
other people see you? 
Q: No, not really. 
I: So if you were going to use some words to explain what you are trying to express 
with the images, what words would you use? 
Q: I don't know. 

I: And just finally how would y
ou usually describe y our ethnicity ? 
Q: English. 
I: Do you always say English? 
Q: Yeah. 

I: Do you ever say British? 

Q: Yeah sometimes. 

I: What one do you use mo re? 
Q: English. 
I: Why do you say English rather than British? 

Q: I don't know, just. 

I: OK that's brilliant. 

 

(L=Lorna, aged 13, female; I=interviewer) 

I: OK let's start with ‚how I see myself'. Do you want to talk through the pictures 
you've used and why you've used them// 
L: //yeah. I've used these animals because I think I, well always with my friend and that 
so whatever happens, I've used Cheryl 
Tweedy who I think, I like her clothes and 
fashionable and that and I've used this
 PlayStation because I t hink that I'm like 
always playing games and in this picture [image of a cricket player] I see myself as a 

sporty sort of person always playing sport. In this picture with the girl smiling I think 

I'm always smiley// 
I: //who is that girl? 

L: She's from 
EastEnders
, Sonia's friend [Naomi]. A picture of a phone, I've used a 
phone because I'm always on the phone and alwa
ys ch atting and that and I've used a 
tele 'cause I'm always wat ching tele. 
I: So let's move onto how you think other people see you. Would you like to go 
through them pictures? 
L: Yeah I've used this lady ag ain because ot
her people might think that I'm quite sporty 
as well. 
I: OK so sporty is on both sides. 



 
362
L: Yeah and I've used this one 'cause I re
ally like watching DVD's and videos and that, 
I've used the bag because I always love
 to go shopping, I've used Peggy Mitchell 
[
EastEnders
 character] 'cause she looks
 worried in that picture and I'm always like 
worrying and I' ve used this girl, I don' t
 know who I can't remember who, because 
it's actually at a party and I love going to parties. 
I: So do you think that there's a differenc
e between how you see yourself and how you 
think other people see you? 
L: Not really, not really different. 

I: There's not? 
L: No. 
I: So if you had more time and you could 
add pictures, what pictures would you add? 
L: Well I'd probably get another one like that 
[image of a girl at a party] and put that 
over there [how I see myself]. I'm not sure what I would do. 
I: And just finally, how would you usually describe your ethnicity? 
L: English. 
I: Do you always say English? 

L: Yeah I don't say British because none of my family are from anywhere else in Britain 
and I'm not from part of anywhere else in Britain, I am English. 
I: Right OK, that's brilliant.",5841,33,33.0,"Self-Perception, Cultural Identity, Emotional Expression, Hobbies and Interests, Celebrity Influence, Youth and Image",0,0,1,0,0,0,1,0,0,0,1,0,0,0,0,0,0,0,0,0,1,0,0,0,0,0,0,0,0,0,0,0,0,0,0,0,1,0,0,1
Anna,13,"I: Do you want to go through the pictures on how you see yourself? 

A: I've got a picture of Lee Ry an because he's got the sa me starsign as me, I've got a 
picture of Little Mo from 
EastEnders
 because she's very emotional, I've got a picture 
of Shelley from 
Coronation Street
 because she's emotional and easily hurt and I've 
got a picture of a little princess because I think I'm a little princess. 
I: You've also got a little devil there as well, what does that mean? 

A: Um (long pause), I don't know. 

Lorna: Maybe ‚cause you' re like quite naughty sometimes at home? You see yourself as 
quite naughty at school and that? 
A: Sometimes, yeah yeah. 

I: Let's move onto how you think other people see you. 

A: I've got a picture of that big mouth because people think I've got a big mouth, I've 
got a picture of that [heart with wings] because my mum and everything think I'm a 

little angel, I've got a picture of a loveheart because some people think I'm loving. 
I: Now on this side [how I think other people see me] you' ve put that you are a loud-
mouth, but on this side [how I see myself] you put that you are quite a worrier and 

easily hurt. Do you think other people see that side of you? 
A: No. 

I: Is that because you don't let them// 
A: //yeah. 
I: Why is that? 

Lorna: You've probably only cried about once in school for the past three years haven't you? 
'Cause I haven't seen you cry much. 
I: Why do you think other people don't see that side of you? 

A: I don't know. 
I: Do you think it's a good thing that other people don't see that side of you// 
A: //yeah. 

I: Why is it a good thing? 

A: I don't know just don't want other people, it's embarrassing. 

I: And if you had more time are there any 
other pictures that you would have added? 
A: I don't know. 
I: You don't know. 

A: Fashionable maybe, I'd have put it on what other people think of me, more on there. 



 
363
I: And just finally, how would you usually describe your ethnicity? 
A: English. 

I: English. 
A: Yeah. 
I: OK brilliant.",2046,34,34.0,"Self-Perception, Others' Perception, Emotional Expression, Cultural Identity, Self-Identity Conflict, Hobbies and Interests, Differences in Perception, Role Models, Celebrity Influence, Self-Identity and Expression, Emotional Complexity, Family Influence",0,0,1,0,0,0,1,1,0,1,1,0,0,0,0,1,0,0,0,0,1,0,0,0,0,0,0,0,1,0,0,0,0,1,1,1,1,0,0,0
Aaron,13,"I: Is this one big collage or two? 
A: Two really. 
I: Do you want to start with ‚how I see myself'? 

A: I play basketball a lot, I'm quite good at it, I love like rap Sean Paul music sort of 
thing. 
I: What is it about rap music and Sean Paul that you like? 
A: It's just its good. 
I: Is there anything about Sean Paul, apart from his music that you like? Is there 
anything about his personality// 
A: //yeah like I like clothes they wear and a
ll that with their clothes and stuff like that. 
I: So you like their fashion? 
A: Yeah. 
I: What about on the other side, on how you think other people see you? 

A: This is good basketball player, people see me as a good basketball player. 

I: You've got basketball on both sides, wh
at does basketball represent? Apart from 
being a good player, is there anything else about the sport that// 
A: //well they wear like the stuff for trainers and all that and clothes they wear shorts 
they wear. 
I: So do you think that's quite a fashionable look? 

A: Yeah. 

I: Do you think other people think that's a fashionable look? 

A: Depends if they like basketball. 
I: So if you were going to use some words to describe how you see yourself, what 
words would you use? 
A: Funny and sporty. 

I: Do you think there's a difference between how you see yourself and how you think 
other people see you? 
A: No. 
I: There's not? 
A: No. 

I: And just finally, how would you usually describe your ethnicity? 

A: English. 

I: You would say English. Do you always say English? 
A: Yeah. 
I: OK brilliant. 

 

(C=Celine, aged 13, female; I=interviewer) 



I: Shall we just start with ‚how I see myself'? Can you go through they pictures and 
explain what they mean to you? 
C: My favourite person is I like Kanye West. I like them [image of the Pussycat Dolls] 
clothes. 
I: You've also got a picture of Danni
 Minogue here, why have you used her? 
C: Becaus e I like her dress. 
I: You just like her fashion. And you've also got the word ‚bling', what does bling 
mean? 
C: I don't know (long pause). 



 
364
I: OK on how you think other people see you you've just got one picture of Beyonce. 
What are you trying to express? 
 What does Beyonce represent? 
C: People say that my hair looks like hers. 
I: So people say that you're hair is like Beyonce's. 
C: And people say that that's the kind of clothes that I wear. 

I: So fashion features on both sides. Do you see yourself as quite fashionable? 

C: A little bit. 

I: Do you th ink other people see you as fashionable. 

C: I don't know. 
I: If you had more time are there any extra pictures that you would have put on? 
C: Yeah. 

I: Like? 

C: I don't know. 

I: You don't know. And just finally how
 would you usually describe y our ethnicity? 
C: Caribbean. 
I: Would you say Caribbean? You wrote down 
English. What one do you usually say? 
C: I don't know, both. 

I: Both. So if I asked y ou what your ethnicity is now, how would y ou answer that? 

C: I'm half English and half Caribbean. 
I: Do you alway s say I'm half English half Caribbean? 
C: Yeah. 

I: OK thanks.",3085,35,35.0,"Self-Perception, Others' Perception, Fashion and Trends, Role Models, Celebrity Influence, Differences in Perception",0,0,1,0,0,0,0,1,0,0,0,0,0,0,0,0,0,0,1,0,0,0,0,0,0,0,0,0,1,0,0,0,0,1,0,0,1,0,0,0
James,13,"I: Are these two separate collages or one? 
J: One I think. 

I: Do you want to go through each of the pi
ctures and explain what they represent, what 
they mean to you? (long pause) Well you've got a lot of games pictures, a lot of 

PS2's, a lot of 
Mortal Kombat
 [computer game] and characters, why have you used 
them? (long pause) 
J: I don't know. 

I: You don't know. 

Carmel: James you always come into school saying you played games until like ten, eleven 
o'clock at night. 
I: Why did you choose them pictures? 
J: I don't know. 
Carmel: James there's no-one in here, you do it in
 front of everyone else but it's only me, it's 
only me here Jesus. 
I: So what words would you use to d
escribe how you see yourself? (long pause) 
J: Not really sure. 
I: You don't want to speak? 
J: No. 

I: OK we'll leave it. 

Carmel: Why don't you just wait until Adrian
 comes down because if Adrian comes down// 
I: //no, it's alright we'll leave it. He do
esn't have to talk if he doesn't want to. 
 
(C=Carmel, aged 13, female; I=interviewer) 


I: Have you done one collage or two? 

C: I've done loads of that [how I see myself] and a little bit of this [how I think other 
people see me]. 
I: Shall we start with ‚how I see myself'? Do you want to go through the images and 
explain what they represent, what you are trying to express with them? 



 
365
C: I've got a Kat Slater [
EastEnders
 character] because I'm always feeling confident in 
my self like she does, I've got Ronaldo and 
a couple of other footballers I look up to 
because I always see myself as inspirational trying to get my own goals and because I 
love football and just Chelsea because I'
ve always supported them daily. I've got 
Sean Wright-Phillips because I think that some
times I want to be like him 'cause he's 
done so much with his life, he got adopte
d and he doesn't really know his other dad 
and like I don' t see my dad often and he' s 
been with other people and I' m with 
someone now different like my mum and her 
boyfriend so I've been with quite a bit 
of people in my life. I've got Spectacular Pretty Ricky and 50 Cent 'cause I love his 
music and I love just phat rhythms music like rap and everything. 
I: Right. 

C: I don't know why I put Mario in this 'cause I've got his birthday, I'm on the same 
day as his birthday so I put him down, I've got Randy Orton 'cause I just love 

wrestling and I love, like not fighting and 
being a little scally or anything, love 
wrestling with my little sister like play-figh
ting 'cause we always see that and we get 
bored and sometimes just play-fight. But th
at's all the pictures I've got on there. 
And I put that DVD down 'cause I' m al ways watching DVD's. 
I: Right, you've put 50 Cent down on how you see yourself to represent that you like 
that ty pe of music// 
C: //yeah// 
I: //but do you think you share anything else with him, because 50 Cent has maybe got a 
bad reputation for being a bit of a gangster// 
C: //no I ain't like him. 

I: Is it just the music you like? 

C: Yeah. 
I: As a person do you think that you would id
entify with him [50 Cent] at all? Do you 
think you share any// 
C: //yeah he raps about his personal life and 
it's good so I do rap. I just sing about my 
personal stuff as him, so he sings about his stuff and I sing about my stuff and I think 

I'm like him sometimes, 
like speaking about his personal stuff in life. 
I: So do you think that's a good thing that rap does that// 
C: //yeah they should show them things 
because otherwise they get across the wrong 
way and they're not what they're made out to be like portray ed in the public. 
I: What about how you think other people see you? You've just used a picture of a 
phone// 
C: //yeah 'cause as soon as I get out of schoo
l as I'm walking home with my friends I'm 
always on the phone like my mum rings me, my dad texts me, my little sister texts 
me, friends in London text me, so I'm alway s texting. 
I: Do you think there's a difference though between how you see yourself and how you 
think other people see you? 
C: Kind of, I don't think people see me as confident all the time. 
I: But you think you are// 
C: //yeah, I am. I always do a lot of things on my own at home. 

I: Like? 

C: I don't think other people see me as 
like feeling a bit stronger, like I am, I've 
overcome a lot in my life like moving house and loads like that. 
I: And if you could have added anymore pict
ures to th at collage, what pictures would 
you have added? 
C: I would have had a phone over there [how I see myself] because I know I'm always 
on my phone and I'm using up my credit, ove
r there [how I think other people see 
me] I think I would have put someone that
 speaks out a lot 'cause I'm alw ays doing 
that 'cause I like chatting and I'm alw ays cha
tting get told off for chatting. I think I'd 
put on some kind of like, something stupid stuff 'cause sometimes it just comes out 
and I think it sounds right. And I don't know what else other people think of me 

'cause I don't really care what they think 
about me, it's what I think about myself. 



 
366
I: So you don't care about other peoples opinions, you just care about yourself? 
C: Yeah. 

I: Is that everybody else? 
C: I care about what my mum says what my fa
mily says and like my closest best mate 
which is only one, I've known her like eleven 
years I take in what she says. But not 
like all like, if those said I don't think you're strong, I would like I don't think I'm 

strong just think I'm confident and feeling a bit better about whatever you say, just 

goes in one ear and out the other as my mum says to me. 
I: And just finally, how would you usually describe your ethnicity// 
C: //English. 
I: Do you always say English? 

C: Yeah. 

I: Do you ever say British? 

C: Sometime s if I'm over in like on a tea m they have a hotel they say we're fro m 
Auckland 'cause that's all around the world, I say I'm from England but I don't tend 
to say I' m English I tend to say I' m British. 
I: Why? 

C: I don't know they're the exact same real
l y, someti mes I only use English someti mes I 
only use British. 
I: Do you think they are the same thing? 
C: Someti mes. 

I: When aren't they? 

C: I don't know. 

I: You don't know. 

C: No. I think I've always thought like sa
y ing 'cause English and British, British is all 
around the country and so is English 'cause Eng
lish is in many parts of the world, and 
you can't really say that sometimes can I 
'cause loads of people speak English and 
they're not from England so I can just
 say I'm British '
cause I'm United Kingdom 
I'm from there. 
I: OK brilliant. 
 
(C=Callum, aged 14, male; I=interviewer) 



I: Do you want to go through the pict
ures on ‚how I see myself' and explain what 
pictures you've used and why? 
C: I've used Amir Khan's picture ‚cause 
I hope to be a boxer and I've used Liverpool 
celebrations because I like Liverpool [football team]. 
I: You've also got this here thoug
h and you've put th e word ‚dumb'// 
C: //yeah I class myself as dumb. 

I: So you see yourself as dumb? 

C: Yeah. 
I: And what's this [image of percentages in a head]? 
C: That's just like people thinking I'm brainy but I'm not basically. 

I: So people think you're brainy but you think you're dumb? 

C: Yeah. 

I: And what is it about boxing, why do yo
u identify with that? Why do you see yourself 
as a boxer? 
C: I don't know, I just like it. 
I: You just like it? 

C: Yeah and I do it with Golden Ring in Shirley [boxing club]. 

I: OK let's go onto how you think other peopl
e see you, you've got a picture of Hitler 
and a picture of a cartoon. Why have you used a picture of Hitler? 
C: 'Cause I think people like take advantage of me, in a way they do but I like he hit 
people for no reason basically. 
I: He hit people for no reason? 



 
367
C: Yeah. 
I: So why does Hitler represent that for you? 

C: 'Cause he killed loads of people 
and I hit loads of people basically. 
I: Do you think that's a good thing or a bad thing// 
C: //bad. 

I: So do you think other people see 
y ou as a good person or a bad person? 
C: Sometimes good sometimes bad. 

I: When would they see you as bad? 

C: When I hit someone. 
I: Do you think that's good or bad? 
C: Bad. 

I: But you still do it? 

C: Yeah. 

I: Do you think there's a difference between how you think other people see you and 
how you see yourself? 
C: Yeah. 

I: What's the difference? 

C: I think I'm average. 

I: You think you' re average? 
C: Yeah. 
I: Do you think other people think that you are average? 

C: No. 

I: What do they think? 

C: Small. 

I: Is that below average? 
C: Yeah. 
I: So they think you're small 
and yo u think yo u're average? 
C: Yeah, I'm average. 

I: If you had more time are there any other pictures that you would have put on? 

C: Like a, a little bit of a paper boy, I'd have put that on there to say that I was a good 
paper boy. 
I: And just finally, how would you usually describe your ethnicity? 

C: British. 

I: Would you say British or English? 

C: Depends where I am. 

I: Can you explain that? 
C: Yeah if I was like in Spain I would say I'm British but if I'm over here I'm English. 
I: Why would you say British in Spain and English over here? 

C: 'Cause my mum says I'm part Irish and Britis
h is to do with Ireland and all that and I 
don't sound like I've got an Irish
 accent, I sound English over here. 
I: OK thanks.",9447,36,36.0,"Others' Perception, Cultural Identity",0,0,0,0,0,0,1,0,0,0,0,0,0,0,0,0,0,0,0,0,0,0,0,0,0,0,0,0,1,0,0,0,0,0,0,0,0,0,0,0
