name,age,content,len,id,sample,labels,Animal Representation,Artistic Expression,Celebrity Influence,Comparison with Others,Complex Self-Perception,Conflict with Self-Image,Cultural Identity,Differences in Perception,Disconnection from Cultural Expectations,Emotional Complexity,Emotional Expression,Emotional Self-Perception,Ethnic Identity,Facets of Self-Perception,Familial Relationships,Family Influence,Family and Relationships,Fashion and Personal Style,Fashion and Trends,Gender Representation,Hobbies and Interests,Humor and Light-Heartedness,Identity and Self-Perception,Influence of Media Figures,Interest in Music and Pop Culture,Media Influence,Mixed Ethnicity Identity,Music Influence,Others' Perception,Perception by Others,Perception of Differing Sides of Personality,Personal Interests and Hobbies,Political Views,Role Models,Self-Identity Conflict,Self-Identity and Expression,Self-Perception,Sport Enthusiasm,Sports Enthusiasm,Youth and Image
Michelle,13,"I: Let's begin with ‚how I see myself'. Can you just go through the pictures that you've 
used and explain what pictures you'
ve used and why you've used them? 
M: Yeah. I've used this woman [Kelly Ro
wland ] b ecau se sh e's quite fashionable and I 
see myself as a fashionable person. I' ve used a picture of a Liverpool football team 

because I see myself as quite a supportive pers
on towards the team. I put a love heart 
because I'm quite a loving person. I also 
put a laptop because I like to explore things 
and try new things. 
I: What about the pictures of Kat, Alfie [
EastEnders
 characters] and, is that Lemar? 
M: Bow Wow. 
I: Let's start with Kat and Alfie, why have you used them? 

M: Because Kat, erm Alfie's quite cheery and he makes people smile so metimes so I just 
like Alfie, and I also have a temper to so I put Kat. 
I: And what about Bow Wow? 
M: I put him because I like him (laughs). 
I: So if you were going to sum up how you see yourself, what words would you use that 
the pictures are trying to express? 
M: Creative, fashionable, quite a happy pe
rson, quite tempered sometimes, powerful, 
respectful. 
I: OK, you said that you can have a temper// 
M: //yeah// 
I: //sometimes// 

M: //yeah. 

I: When you say get a temper do you mean you get angry? 

M: Yeah. 
I: What types of things make you angry? 
M: My sister borrows stuff from me and, um
, sometimes I don't get things my own way. 
I: Sometime s you don't get things your own way . 

M: Yeah. 

I: Can you give me an example? 
M: Like if I was quite tired and just don't 
want anybody staying and something like that, 
and I can't go out late. 
I: OK. 

M: Yep. 

I: Now on this side [how I think other pe
ople see me] you've used a picture of Cat 
Deeley, a horse and the New Look logo and a phone. What are you trying to express 
on this side? 
M: I think other people see me as a trendy and 
fashionable person so they know that I 
like to go and buy clothes and things like that. 
I: So, you've got fashion on both sides// 

M: //yeah// 
I: //do you think though that there' s a di
fference between how you see yourself and how 
you think other people see you? 
M: There's a fe w differenc es I think and there's a few sa me, 'cause like so me people 
know I'm fashionable and some people don't but
 I think some people see me as quite 
a trendy person and like, I like different things. 



 
289
I: How do you think other people see you differently to how you see yourself? You 
said that there are some differences, so
 apart from the fashion, what else? 
M: Some people think I'm quite a calm person but I can actually have quite a temper. 
I: So they think you are quite calm? 
M: Yeah but I didn't actually find a picture for that yet. And like the horse actually, um 
resembles me because I'm a kind person by whole. 
I: OK, so it's really the temper// 

M: //yeah. 

I: So if you were going to use a picture to represent temper, what would you use? 
M: I would put either put a cat, I think also I'd put, um, may be like some [inaudible]. 
I: And if you had more ti me, are there any 
other pictures that you would have put onto 
your collage? 
M: I would have put more on how I see myself 
and go into more details like my feelings 
and that I can be quite an emotional person and friendly. 
I: And what would you use to represent emotional and friendly ? 
M: Maybe two characters in quite a emotional scene or something. 

I: Is there any one that y ou think of in particular when you think of emotional? 

M: Maybe Kat and Zoe [
EastEnders 
characters] or somebody like that. 
I: So, because of Kat and Zoe's relationship? 
M: Yeah. 
I: And just finally, how would you usually describe your ethnicity? 

M: Like I come from like all different bac
kgrounds, different like, different types of 
families. 
I: But if I asked you what your ethnicity is, how would you describe yourself? 

M: English. 
I: You say English. 
M: Yeah. 

I: Do you ever say British? 

M: No. 

I: Do you know// 
M: //I don't know why. 
I: So you just say English, you don't know why. 

M: Yeah. I just say English. 

I: OK, that's brilliant.",4125,1,1.0,"Self-Perception, Others' Perception, Differences in Perception, Emotional Expression, Fashion and Trends, Self-Identity Conflict, Familial Relationships, Celebrity Influence, Self-Identity and Expression, Complex Self-Perception",0,0,1,0,1,0,0,1,0,0,1,0,0,0,1,0,0,0,1,0,0,0,0,0,0,0,0,0,1,0,0,0,0,0,1,1,1,0,0,0
Sapan,13,"I: You've just done one collage yes [how I see myself]? 

S: Yeah. 

I: Can you just go through the images and words you've used and explain what you are 
trying to express with them? 
S: I've got a picture of this game [image
 of a computer game] because I really like 
playing games a lot, and I'm a Hindu that's why I put a symbol. 
I: What is this a symbol of? 

S: Hindu. 

I: This says Hindu? 

S: No it's Ohm. 
I: Ohm. 
S: Yeah. 

I: So yo u've got the word ‚Hindu' and you've got the Ohm sy mbol, and you've also 
got// 
S: //the flag// 
I: //the Indian flag. 
S: Yeah. 

I: What about Darth Vader [
Star Wars
 character]? 



 
290
S: I just like films a lot. 
I: Why did you choose Darth Vader? 

S: 'Cause that's kind of like th e films which I like, action films. 
I: Action. 
S: Yeah. 

I: And who are these two people [image of Indian actors]? 

S: They're just like Indian actors. 

I: And why have you used them there? 

S: 'Cause I like often look at, watch Hindi films. 
I: Hindi films. 
S: Yeah. 

I: Are these famous Hindi actors? 

S: Yeah, they're kind of like top. 

I: What about this cricket bat? 
S: I quite like sports and cricket. 
I: So you like sports and cricket as well? 

S: Yeah. 

I: Now, going back to these actors, who is this guy? 

S: I've forgot his name. That's 
Ashwaria [image of Indian actress]. 
I: Now on this collage there is a lot about 
being Hindu and the fact that you are from 
India. Is that very important? Are you trying to express that you feel more closely 

connected to being Indian? 
S: Yeah. 

I: Could you explain a little? 

S: I just quite like watching films actually and I'm Hindu. 
I: Is your culture important to you? 
S: Yeah. 

I: It is. 

S: Yeah. 

I: Now on this side, ‚how I think other peopl
e see me', you'v e not got any pictures. Is 
that because you don't think there is a difference or because you didn't have time? 
S: I didn't have time and I didn't ki
nd of like know how other people see me. 
I: Do you think that if you had more time to work on this and you had time to think 
about it, do you think how you see yourself would be the same as how you think other 

people see you? 
S: No, it would be, they wouldn't like kind of like see me as like playing games and into 
films. 
I: So what do you think they [other people] would see you as? 

S: I don't know. 

I: What do you think people think when they see you? How do you think they see you? 

S: Kind of like average not that much. 
I: So average. 
S: Yeah. 

I: Do you think you're average? 

S: No, not that mu ch. 

I: No. 

S: No. 
I: Do you think you're more than average? 
S: Yeah. 

I: So do you think if I took away the Indian flag and the Hindu symbol that the whole 
collage would have a different meaning? (lon
g pause) Were y ou born in this country? 
S: Yeah. 
I: But there is no British flag. So let's say, for example with the flags, why did you 
choose to use the Indian flag instead of
 the British one? Why did you choose to put 
Hindu? 



 
291
S: I would have put England as well but I didn't have time, but Indian because my 
parents co me from that cou ntry . 
I: So your parents come from India but you were born here? 
S: Yeah. 
I: So how would you usually describe your ethnicity? 

S: Indian. 

I: You'd say Indian? 

S: Yeah. 

I: So you'd say Indian even though you were born here [England]? 
S: Yeah. 
I: Yeah? 

S: Yeah, well not exactly. 

I: Why not exactly? 

S: 'Cause like I was born from here but I'm still Indian. 
I: Why are you still Indian? 
S: Because my parents come from India and I often go there. 

I: So do you identify more wi th being Indian than with British or English? 

S: Yeah. 

I: Is it important for you to let people know that you are Indian? 
S: Not that much, but still kind of like would like people to know that I'm Indian so. 
I: OK brilliant.",3847,2,2.0,"Cultural Identity, Emotional Expression, Familial Relationships, Sports Enthusiasm, Hobbies and Interests",0,0,0,0,0,0,1,0,0,0,1,0,0,0,1,0,0,0,0,0,1,0,0,0,0,0,0,0,0,0,0,0,0,0,0,0,0,0,1,0
Jason,13,"I: So Jason, are these two separate collages or one? 
J: They're separate. 
I: Shall we start with ‚how I see myself'? 

J: Yeah. 

I: Do you just want to go through the im
ages and explain why you've used them, what 
you are trying to express? 
J: Well I've got the gun because I get really fi
ery and angry, I got like the calm [image 
of a person in silhouette] because I like to
 be calm you know like at home, I chose 
like the mini motor because I like being fast and rushing, I don' t like animal cruelty 

that's why I got the zebra, there's some games I like [image of a wrestler] like 

wrestling and I like Triple X, a good film like stuff I like, I like alcohol. 
I: You like alcohol? 
J: Yeah. 
I: How old are you? 

J: Thirteen. 

I: But you like drinking? 

J: Yeah not like// 
I: //why do you like drinking? 
J: 'Cause I just like, it's just nice to have different drinks and it's nice and I like the 
taste. 
I: How much do you drink? 

J: Oh I drink one bottle a week, only like Bacardi Breezer one of them. 

I: With your friends or with your family// 
J: //with my mum. 
I: With your mum// 

J: //yeah with my mum's permission. 

I: OK, what about this picture of the boxer? 

J: Because I like boxing and I've always wanted to be a boxer. 
I: What is it about boxing that you like? 
J: To just take all your anger out and like 
respond powerfully , it's really good, and then 
afterwards you're really calm. 



 
292
I: But is it taking your anger out on a person or just being able to take your anger out 
that you like? 
J: Just get my anger out th at's better. 
I: Just get your anger out. 
J: Yeah. 

I: So we've got a mobile phone there// 

J: Yeah 'cause I like keeping (mumbles). 

I: You like? 

J: Keeping up-to-date stuff on the phone. 
I: OK and who is this [image of a wrestler]? 
J: Yeah, I like him. 

I: Who is he? 

J: I don't know his name I think its The Rock
. 'Cause he's like my wrestling hero, he's 
not a dirty fighter he's a clean fighter that's good. 
I: So even within fighting th ere are still rules// 
J: //yeah, some people like get a big chain and hammer and all that but he's a really 
clean fighter. 
I: And what about Kat Slater [
EastEnders
 character]? 
J: Oh she, like she like, 
EastEnders
 if it didn't have someone like Kat Slater it would be 
really plain, like if I like didn't have 
a lot of my friends around I think it would be 
really plain and boring. 
I: So you think Kat Slater is quite plain? 

J: No, she's really fiery and she's really good 'cause I like that. 

I: Oh, so she's kind of similar to how
 you feel. She's quite a fiery person// 
J: //yeah, and like she's not afraid to do anything. 
I: So y ou like her assertivene ss// 
J: //yeah// 

I: //and that she's a bit// 

J: //yeah, she's not really quiet she's not afra
id to say anything she just comes out with 
it. 
I: And finally on this side you've used a flag of England. 
J: Oh because th at's my home country. 

I: Your home country. If you were going to
 use some words to 
describe the feelings 
that you are trying to express in all th
ese pictures, what words would you use? 
J: Like really, that's how I feel I am. 

I: So what types of words would you use? 
J: Like ambitious and I like get on with things and that. 
I: You're ambitious, y ou like to get on with things. You can be quite calm? 

J: Yeah calm when I really want to be. 

I: And quite angry ? 

J: Yeah. 
I: What makes you angry? 
J: Teacher s. 

I: Just teachers? 

J: And people like, time is just sitting there 
going really slow and all that and it gets 
really frustrating and I find that makes me really angry. 
I: What about [image of a zebra]// 
J: //oh, animal cruelty I hate that. 
I: What is it about cruelty to animals that// 

J: //they kill them to test them and like 
make-up and that, and I think that's really 
wrong. 
I: Why is it wrong? 
J: Because it's not fair like that they're dyi
ng and that just so we can get a lipstick like 
what won't last very long. 



 
293
I: So do you think there can ever be a time where you can test on animals and it would 
be alright? 
J: Um, no I don't think there can. 
I: Not even for medicine? 
J: For medicine that's different, for make-up I// 

I: //so for cosmetics// 

J: //no, medical yeah I understand that, but make-up no. 

I: OK let's move onto how you think other people see you. Do you want to go through 
the pictures again and// 
J: //that big like devil because everyone say
s like I'm fiery or I can get really angry 
loads and the little devil because the teacher
s say to me, Miss Staines will say she 
always calls me a little devil. 
I: You've also got a picture [image from animated film 
Madagascar
] of// 
J: //oh yeah, because I'm a family person. 
I: So what's that from? 
J: 
Madagascar
, yeah I like that film. 
I: And you've also got pictures of sport, like the cars and the football. 

J: Yeah 'cause I like my cars 'cause I love my cars and Man Utd and Saints and 
England. 
I: And what about the picture of this girl [how I think other people see me]? 
J: Richard my best mate he says I'm obsessed by girls. 

I: You're obsessed? 

J: Yeah he says. 

I: And are you? 

J: Um, I don't know, I'm not sure. 
I: So we've got fiery and angry and the devil 
which is here [how I see myself] as well, 
but do you think that there is a differen
ce between how you think other people see 
you// 
J: //yeah. 

I: What's the difference? 
J: Because Samuel thinks I'm like that ther
e [angry and fiery], so he thinks I've never 
got a quiet side to me, but I have, I've got like a really quiet side to me and I've got a 

really angry side. 
I: So y ou think other pe
ople only see the angry side? 
J: Yeah. 

I: So why do you think other 
people don't see the quiet side? 
J: Because I get wound up really eas
y, you know I'm always annoyed. 
I: You're always annoyed// 

J: //yeah// 

I: //but you have got a quiet side? 

J: Yeah, yeah. 
I: Do you usually, when you're at home// 
J: //yeah, I'm really quiet and I just go and play PlayStation and listen to music. 

I: What type of music? 

J: R&B. 

I: R&B. 

J: Yeah and Eminem. 
I: What is it about Eminem that you identify with? 
J: Because he talks about his life and people and all that. 

I: Why is that a good thing? 

J: Because it makes me think what I do during the day. 

I: It makes you think// 
J: //what I done in the day, why I have done things and all that. 
I: But do you think there is anything bad about Eminem? 



 
294
J: He is really because he sort of carri
es stuff around with him like he takes drugs and 
that's bad. 
I: So you don't agree with that// 
J: //no I don't agree with taking drugs and smoking, but I like his music. 
I: But you like his mu sic because he's talking about his life// 

J: //yeah he's talking about life and all that// 

I: And that mak es y ou think about your own life// 

J: //yeah all the things that I've done wrong and don't want to do again. 

I: If you had more time are there any extra pictures that you would have put on? 
J: Yeah I would have like to have put some
 more calm pictures on because I do like to 
be calm. 
I: You would have like to have put more calm pictures on. 

J: Yeah, because I do like being calm. I am calm at home a lot but when I'm at school I 
get really angry, but at home I'm really calm and relaxed. 
I: What do you think it is about outside that makes you angry? Is it just people? 
J: Yeah it's when people get in the way and that and like in school, and I just barge past, 
I hate waiting around. 
I: It's the waiting around, you can't stand it? 

J: Yeah waiting around, like just get on with things. 
I: And just finally, how would you usually describe your ethnicity? 
J: I'm not religious but I do believe in my country. 

I: So would you say that you were British or English? 

J: I'm English. 

I: You would say you were English? 

J: Yeah. 
I: Why would you choose English over British? 
J: Because British that's a really big place, like I'm in England and I know it's the 
football team as well, 'cause British that's Scottish as well. 
I: So English is like// 

J: //yeah my home// 
I: //your home and more specific// 
J: //yeah. 

I: What does being English mean to you? 

J: Like England's got their own football team
 and all that, and England is just like a 
separate name, your standard. 
I: What do you mean your standard? 
J: Because British is just like a totally diff
erent flag innit', England and British totally 
different flag. I find English means a lot more. 
I: English means a lot more. 

J: Yeah. 

I: Why does it mean a lot more? 
J: 'Cause we use it a lot mo re, it's mo re
 common. British, that sounds wrong. 
I: OK, that's brilliant.",8701,3,3.0,"Self-Perception, Others' Perception, Emotional Expression, Hobbies and Interests, Familial Relationships, Role Models",0,0,0,0,0,0,0,0,0,0,1,0,0,0,1,0,0,0,0,0,1,0,0,0,0,0,0,0,1,0,0,0,0,1,0,0,1,0,0,0
Malcolm,13,"I: OK Malcolm, are these two separate collages or are they one? 
M: That one [how I se e my self] is what I li
ke doing, whereas that one [how I think other 
people see me] i s how I think people see me. 
I: So let's start with ‚how I see my self'. Do
 y ou just want to go through the images an d 
explain why you've used each image, what you are what you are trying to express 

with them? 
M: I've used those two [images of a guitar 
and Gorillaz] because I like music and I look 
up to them. 
I: What is it about the Gorillaz that you look up to? 



 
295
M: I think they're a good band and also the singer, um// 
I: //Damon Albarn. 

M: Yes him, has lots of political views that I agree with. 
I: Such as? 
M: Stuff like the Live 8 thing he said they 
should have had more mu
lticultural bands and 
I agreed with that. 
I: You agree with// 

M: //his views about Live 8 and how that was run and everything. 

I: What about his other political views? 
M: I don't know but I assume he's good like 
that across mo st stuff that I don't agree 
with. 
I: OK, I know you relate to Damon Albarn and 
his politics, but what is it about that th e 
music that you specifically like? 
M: I think it's different but still interesting a
nd not sort of annoying it's a, it's cool but 
it's not annoying and you can listen to it anytime without it being annoying. 
I: So it's kind of like the fact that it's not mainstream, run of the mill// 

M: //yeah it's relaxed and sort of guitar driven. 

I: You've got a little picture of 
The Simpsons
 [cartoon] there. 
M: Yeah, that's just because I like 
The Simpsons
 really, it's funny. 
I: OK. 
M: I've got two games because I like playing PlayStation ‚cause its fun. I've got a 
picture of George Bush with a red line ac
ross his face because I disagree with the way 
that he does things. 
I: Such as? 

M: Such as the war in Iraq for example. 
I: Why do you disagree with that? 
M: Because I don't think its fair or
 the right way to go about things. 
I: What// 

M: //just violence you know what I mean. 

I: So you don't agree with war or violence? 
M: No, and I don't think that w
as the right time to use it either. 
I: When would have been the right time to use it? 

M: I don't know, I think they were ill-informed and rushed into it. 

I: OK, and who are these guys [image of a black model and Michael Jackson]? 

M: Well that one [image of a black model] it'
s because I think he looks pretty stylish and 
chilled out, and I put in Michael Jackson b
ecause he's an amazing dancer, he's just 
cool. 
I: You think Michael Jackson is cool? 

M: Not nowadays, but I think he was cool when
 he did all his amazi
ng dancing and that's 
why he's an icon, but not anymore. 
I: So are you using him on the basis that he is cool? 
M: Yeah. 
I: So if you were going to use a few words to sum up what you are trying to express 
with the images, like we've got cool, what other words would you add to that? 
M: Relaxed and not popular in terms of 
mainstream what everybody likes, and not 
unhappy because I'm always sort of grateful. I don't like really miserable stuff. 
I: So are you quite a content person? 
M: Yeah, yeah I'm happy with my life kind of thing. 
I: So let' s move on to how 
you think other people see you. 
M: Well those two [image of a black man with scarf over mouth and a black and white 
model] it's about, I think people might see 
me as threatening when I'm walking down 
the street with my friends and things 'cau
se we shout a lot and talk loudly and I sort 
of like maybe look threatening to other people. 
I: And you've also got the word ‚shifty' there. 

M: Yeah. 



 
296
I: Is that because you think people might think you are a bit of a shifty character? 
M: Yeah, when we're sort of walking down a
nd sort of shouting and being loud and what 
we're doing and everything. 
I: Because the people that represent thre aten
ing are the black guy with the Union Jack 
around his mouth and, do you know who this
 person is [black and white image]? 
M: No, but I just thought he was sort of// 

I: //why does he look threatening? 

M: Because he's in black and white and he's sort of standing th ere, he looks sort of like 
he's gonna, I don't know he just looks 
like, like threatening and out there. 
I: And what about this guy [image of a black man], why is he threatening? 
M: ' Cause he' s got his arms cr ossed and he's all sort of, um threatening looking. 

I: OK, let's move onto this man with flowers round his neck. What does he mean? 

M: He's like that because I'm meant to be la
ughing a lot of the time and he's sort of 
wearing bright clothes which I don't normally wear bright clothes I sort of act in a 
sort of happy, laughing, jolly sort 
of way which is how he' s dressed. 
I: And what about these pictures of the skater and the t-shirt [‚if you see anyo ne else 
wearing this t-shirt I must be dead']? 
M: Well I like skating and I like skating in public places although not much anymore, but 
I still do it now and again and I thought th at was a cool t-shirt. 
I: So do you think there's a difference between how you see yourself and how you think 
other people see you? 
M: Yeah that's much more, how I think ot
her people see me is much more a sort of 
outward appearance, whereas that [how I see myself] is what I like to do and how I 

like to be. 
I: So you said other people might see you as threatening, do you think you are 
threatening? 
M: I don't personally think I am threatening but I must seem very loud and shouting and 
things. 
I: Right, so do you think when other people look at yo u they see yo u as somebody who 
is interested in politics and who is quite
 relaxed and removed from the mainstream, 
not part of the mainstream and who thinks a bit differently? 
M: Yeah, yeah but only if they know me and everything. 

I: But what if they don't? 

M: If they don't know me they just think I'm another person that's just being sort of 
annoying and threatening and everything. 
I: Does that annoy you, that fact that people think about you that way? 
M: Sometimes but not really I just see it as, 
well I don't really know them or anything so 
it's no big deal I suppose. 
I: And just finally, how would you usually describe your ethnicity? 

M: I'd say I was British or English. 

I: Which one of them do you usually use? 
M: I'd use British because some of my family is from Wales. 
I: So y ou'd use British because// 

M: //it includes everyone in my family. 

I: OK, brilliant.",6486,4,4.0,"Self-Perception, Others' Perception, Differences in Perception, Emotional Expression, Music Influence, Fashion and Trends, Self-Identity Conflict, Familial Relationships, Sports Enthusiasm, Celebrity Influence, Self-Identity and Expression, Hobbies and Interests, Complex Self-Perception",0,0,1,0,1,0,0,1,0,0,1,0,0,0,1,0,0,0,1,0,1,0,0,0,0,0,0,1,1,0,0,0,0,0,1,1,1,0,1,0
