Fiona,13,"I: Is this one collage or two separate collages? 

F: One collage. 

I: One collage. Do y ou want to go through the imag es and explain what y ou were 
trying to represent and express with the images and the words? 
F: Well my family think I'm quite a funny pe
rson and I thought Ant and Dec were quite 
fun so I put a picture of them down, my dad 
thinks I'm loyal so I stuck a picture of a 
dog and a Crazy Frog represents 'cause I'm 
quite annoy ing sometimes so, and I like 
children so I stuck a picture of a child on there. 
I: You've got a picture of Gwen Stefani and also Joss Stone, what are you trying to say 
with them? 
F: I'm not quite sure I thought it was quite um, they're really like kind people. 

I: Kind in what way? 

F: I'm not sure, um. 

I: What is it about them [Gwen Stefani and Joss Stone] th at you identify with? 
F: Well Gwen Stefani and Joss Stone are really unique and that's what I thought of me. 
I: OK and that's Leanne Battersby [
Coronation Street
 character]. Why have you got 
her there? 
F: I can be quite harsh and bitchy sometimes and I think that's what she's like so. 

I: And you've also got Kat Slater [
EastEnders
 character]// 
F: //yeah yeah// 
I: //so they represent// 
F: //the horrible side of me. 

I: The horrible side// 

F: //yeah. 

I: And who is this [Sean from 
Coronation Street
]// 
F: //he's from 
Coronation Street
 he's funny. 
I: Is that the gay character// 

F: //yeah// 

I: //I can't remember his name// 

F: //Sean I think yeah. 

I: So he's there because// 
F: //same like funny and you know quite adventurous and stuff so. 
I: And y ou've got words as well like ‚confident', ‚adventurous', ‚bubbly' and 
‚talkative'. You've also got a Coke can here with a big cross, what's that? 
F: I don't like it; I don't really like that sort of thing. 

I: Why is that? Do you mean Coke that you don't like? 
F: Yeah and like all fizzy and like that. 
I'm quite a healthy person I think and I'm 
showing that I don't eat loads of rubbish, but I've got chocolate there (laughs). 
I: What about// 

F: //clumsy. 

I: Oh, it's a glass knocked over. 

F: Yeah. 
I: And you've also got Betty Boop [cartoon character]? 
F: I don't know, I think it's something my mum said but I can't remember what she said 
now. 
I: And you've also got the// 

F: //yeah to show// 
I: //the flag to show your// 
F: //y eah, my country . 



 
401
I: So do you think that how you see yourself is the same as how you think other people 
see you// 
F: //yeah// 
I: //or do you think there are any differences? 
F: No they're really similar. 

I: They are? 

F: Yeah. 

I: And just finally how you would usually
 describe your ethnicity, what would you 
usually say? 
F: British. 
I: Would you say British or English? 

F: Not sure yeah I think English. 

I: It's what you would usually say? 

F: Yeah English. 
I: So why would you say English and not British? 
F: I' m not sure, I' m not sure actually. 

I: OK that's great.",2959,52,52.0,Fashion and Trends,0,0,0,0,0,0,0,0,0,0,0,0,0,0,0,0,0,0,1,0,0,0,0,0,0,0,0,0,0,0,0,0,0,0,0,0,0,0,0,0
Keith,13,"I: Keith, you've done two separate collages but you've drawn the images. Now why 
didn't you use any of the images that were supplied? 
K: Because none of the images seemed to suit me. 

I: Why is that, because there was quite a wide variety? 

K: Because, because some of them were like
 sports and pop star magazines and I'm not 
really interested in those kinds of things like cars. 
I: OK, what types of images would you have liked? Are there any magazines or books 
or programmes that you would have liked images from? 
K: Well I like images from th e paranormal and things weird because I like to investigate 
those sorts of things because I'm 
interested in the paranormal. 
I: So let's start with ‚how I see myself'. 
K: Well I used the yin-yang sign for balan
ced because most people would punch other 
people for insulting them but I don't, I keep my temper under control so that's why 

I'm balanced. 
I: And you've also put here that you do martial arts. 

K: Yeah, I do karate and self-defence so if anybody tries to attack me I can defend 
myself. 
I: And what do these two mean? 

K: Well I used t he Irish flag because I' m l u
cky because I have a loving family and I'm 
used to getting through most of my life with
 luck and my family, I come from Ireland 
and we're an Irish fa mily basically . 
I: And you've also got that you like basketball. What is it about basketball that you 
like? 
K: Well I just like playing it for fun and it's the kind of sport I can get into not like 
football I hate football. 
I: What is it about football that you dislike? 

K: Well I don't quite understand the rules 
very well and when it comes to somebody 
kicking the ball towards me it either hits
 me in the face or in other places. 
I: And you're also interested in the parano
rmal and you're double-jo inted. What is it 
about the paranormal that you identify with? 
K: Well I'm interested in the fact that, in
 the paranormal like ghosts and everything, 
because some things can't be explained and 
others can and that's why I'm interested 
in the paranormal because there's some spirits on the other side trying to 
co mmunicate with us and that helps me believe that there's a n afterlife, life after 

death, so I won't actually have to worry about death after that. 



 
402
I: OK, let's move on to how you think othe
r people see you. You've written ‚funny', 
‚different', ‚normal', ‚weird' and ‚strange
'. Now normal and weird and strange, don't 
they go against one another? 
K: U m yeah. 
I: So what do they// 

K: //well weird as in, when it comes to like 
football and everything which is the sport I 
hate I'd just like to sit back and read 
a book that's why people would call me weird, 
and freaky because I do like my
 double-joints, and normal because I sometime stay 
with the crowd and other people. 
I: In what type of situations would you stay with the crowd? 
K: Well, if I'm like talking with my frien
ds while we're walking along and everything I 
just act like I'm doing my own thing and that's why I defer as normal. 
I: You've written the word ‚disgusting' here as well, what do you mean by that? 

K: Well if you had a pencil case I would show you but you don't have one with you right 
now. 
I: Right. 

K: But disgusting like double-jointed thumb a
nd I can make my hands go really far back. 
I: Do you think people don' t really see who you are, or how you really feel about 
yourself? 
K: Um, I don't know really because, well, the reason these two are different is because 
how people think and see me, I just sometimes 
act and talk to people, whenever I do a 
few things that they either decry me as one of those things [weird and freaky]. 
I: Does that upset you? 

K: No because I know everybody is different
 and that doesn't worry me, but sometimes 
it does tick me off when other people ca
ll me gay because I'm not gay and it just 
really annoys me. 
I: So they mean gay as in homosexual? 

K: Yeah. 

I: And they are saying that in a negative way? 

K: Yeah. 
I: Do you think that being gay is a negative thing? 
K: Not really because it doesn't matter if you're gay or not, you're just normal and it's 
basically your choice. 
I: And just finally, how would you usually describe your ethnicity? 

K: Ethnicity , um, I would say I'm Irish because my family , because my family they're 
Irish because I come from an Irish family I w
ould be declared as Irish but I can't here 
because I live in Britain so 
I'm declared as English. 
I: So if somebody asked you what would you say? 

K: I would say I'm Irish but I live in Britain. 

I: Were you born here? 

K: Well yes I was born here but I do come from an Irish family. 
I: And it's important for you to maintain that. 
K: Yeah. 

I: OK that's brilliant. 

 

(C=Charlotte, aged 13, female; I=interviewer) 


I: You've done two separate collages// 
C: //yeah// 

I: //so shall we start with ‚how I see mysel f'? 

C: Yeah. 

I: I'd just like it if you could go through the pictures and explain what you're trying to 
express with each of the images. 
C: I put Converse there because like I wear th
em quite a lot and um, and I've put like 
um// 



 
403
I: //Green Day// 
C: //Green Day 'cause I really like them a nd 
I've put that [image with colours] 'cause 
like loads of colours it's 'cause I'm quite 
bubbly and I've got loads of like sides to 
myself sort of thing, not like in a nasty 
way, I' ve put an eye because like people see 
me as quite I'm quite nosey and I like watching and Chrissie Watts [
EastEnders
 
character] 'cause she's like a bit of a, she'
s loud ain't she and I feel that I'm quite 
loud. 
I: I just want to go back to Green Day, now you obviously like their music// 

C: //yeah. 
I: What is it about them though that you identify with? 
C: 'Cause like I've got a guitar and everythi
ng as well I like playing that type of music 
it's not just them I like punk music and that it's 
 like their type of music, their sort of 
like I look up to them. 
I: Why do y ou look up to them? 
C: 'Cause I think they're really good at playing music and that and I like to play music. 
I: So do you think they are positive role models? 

C: Yeah yeah. 

I: What ty pe of positive things do you think that they do, or how in y our ey es are they 
positive? 
C: Well I don't know, they're not very positive 
they're quite moody actually but it's just 
like their music and everything. 
I: OK let's move on to how you think other people see you, do you want to explain// 

C: //yeah I put like Christine Aguilera 'cau
se every one see s me that I'm like he r just 
'cause I look like her. 
I: So it's nothing to do with personality? 
C: No it's just 'cause people see me, they th
ink that. Like when they see me 'cause I 
wear make-up a lot, they probabl
y think I like the Pussycat Dolls. 
I: And do you? 

C: No I hate them. 

I: Why do you hate them? 
C: I don't know my sister likes them I just don't like their music really much. 
I: So you're not really into pop? 

C: Um well it depends, I do like some pop 
music but I just don't like Cat Dolls// 
I: //them// 

C: //yeah. I've got jewellery 'cause like I 
wear quite a lot of jewellery and I like 
accessories and I quite like that picture it's like black and white it's plain and then 
inside you can see it's colourful [image of 
an eye], and people see me as a plain and 
boring person but inside I'm sort of
 wacky and thingy and weird like that. 
I: So do you think how you think other people 
see you is completely different to how 
you see yourself// 
C: //yeah. 
I: Why do you th ink th at is? 
C: At school like I haven't got many friends 
so and like people see me and I don't really 
walk around like I would when I'm with my 
friends, I'm quite qu iet in front of like 
other people in the school and that's probably why. 
I: Does it bother you th at other people don't see what you are trying to express, like 
how I see myself? 
C: Yeah. 
I: It does bother you? 

C: Yeah. 

I: Do you think there's anything you can do to get over that? 

C: Not really no, I don't know. 
I: You don't know. 
C: No. 

I: And just finally how woul
d you usually describe your ethnicity, what would you say? 



 
404
C: I'd say that I was English but if I had to
 go into more detail I'd say I'm like half 
Welsh. 
I: Half Welsh. 
C: Yeah. 
I: But you say you're English? 

C: Yeah. 

I: Were you born in England? 

C: Yeah I was born in England and my dad's Welsh. 

I: Do you consider any part of yourself Welsh or do you consider yourself completely 
English? 
C: I consider myself sort of bit Welsh becau
se of my dad but if somebody came u p to me 
in the street I would just say I was Eng
lish 'cause that's where I was born and most 
of my family are English so yeah. 
I: OK brilliant. 
 
(C=Christina, aged 13, female; I=interviewer) 



I: Is this one big collage or two? 

C: It kind of all blended into one becau
se how I see myself and how other people see me 
is like same thing. 
I: So do you just want to go through the images and explain what you were trying to 
express with each of them? 
C: Yeah. Well on that one [word ‚respect'] there's like, I like treating people with like 
respect and I think they should have the same respect as everyone else so I put that 

one there. 
I: And you've got Patsy Kensit there, why have you used her? 
C: Becaus e in 
Emmerdale
 she's like quite bitchy and I can be quite bitchy sometimes but 
not, if I said something I will say it to someone not behind their backs I think that's 

harsh. 
I: And you've also got some babies here. 
C: Yeah because I like children and stuff and 
I'd like to work with children and stuff I 
think y eah, and like I want to have
 children when I'm older as well. 
I: And then next to the children you've got some guns// 

C: //oh (laughs) I didn't mean to put that th
ere it's just like the last one I done, but I 
don't think gun crime is right and stuff and 
I don't think they should give it to people 
'cause people shouldn't die without a reason. 
I: So y ou are ac tually anti-gun? 
C: Yeah yeah. 

I: And you've got a picture of the UK and Ireland. 

C: Yeah. 

I: Why is that? 
C: Because I come from Britain and stuff and I'll probably always live in Britain only 
'cause I like it. 
I: What about the tiger? 

C: Well I'm quite nice and stu
ff but people say if I get like 
aggressive I get like quite, 
not like aggressive and stuff, but I can get quite angry and feisty and stuff yeah. 
I: And you've got water// 
C: //because I can be like quite calm and stuff and I'm like, my star sign is like Aquarius 
so I put that 'cause it's like water. 
I: And you've got a patchwork elephant// 

C: //because some people say I'm like quite br
ight and colourful and bubbly and stuff 
and that's how I am. 
I: And you've got the word ‚bubbly' as well. 
C: Yeah. 

I: Now you've got some cleansing wipes a
nd the words ‚hair heaven', what is that? 



 
405
C: Because I want to be a lawyer when I'm older but if I had a second job it would be 
like beauty and hair and stuff because I always do like my sister's hair and 

everybody's hair and stuff and I just enjoy 
doing people's hair and like beautician and 
stuff so I'd like to do that. 
I: What does the ‚Jam Festival' [words ] mean? 

C: Oh it's meant to be like music and st
uff 'cause I like quite a lot of music. 
I: So do you think that there are any differences between how you see yourself and how 
you think other people see you? 
C: I think I'm, I can be quite horrible and quite nasty and stuff but people say I'm not 
like that but they say I'm like nice and stuff and I always try and help people and stuff 
and all that and all the teachers say I try an
d help people but that just comes naturally 
to me and I don't do it just to do it, I do it 
'cause it just comes to me to do that mayb e 
'cause I'm a girl. 
I: So it's just in your nature? 
C: Yeah yeah. 
I: And just finally, how would you usually describe your ethnicity? 

C: I'd probably say I'm English probably, or British. 

I: Which one would you most probably use? 

C: British. 
I: Why would you say British and not English? 
C: Because like Great Britain is like the whole country and I see myself as part of the 
co mmunity , and English is like just one bit and it's like kind of like separated, if you 

say Britain it's kind of join ed so like more
 people like me are in Scotland and Wales 
and stuff and like Great Britain is like one country it's not divided. 
I: OK that's brilliant. Thanks. 



 
406
Appendix B.7: Twynham School Group Two
 
 
(C=Christopher, aged 13, male; I=interviewer) 


I: You've done one collage, ‚how I see myself'. 

C: Yeah. 

I: Do you want to go through the pictures and explain what you are trying to express 
with each of these images? 
C: OK well I've got like lots of like sporty
 type like skiing and roller-skating and stuff 
'cause like I like to do a lot of activities, not
 just mainly football and cricket, like 
extreme sports, and this the ‚Danger Rocks' 
sign that's sort of like the surfy style but 
I'm quite dangerous, I'm willing to do 
anything if you know what I mean. 
I: Right. 
C: So I'm willing to like do, well explore into 
different things, and here see the hair gel 
I've got, I just like I usually have my hair
 spikey I haven't got it at the mo ment but 
usually I have my hair all spikey and like that's what most people, I did that on both 

sides 'cause I thought people see me as like 
with hair, hairstyle yeah. And I've got 
Australia a map of Australia because I really 
like Australia I've been there once and I 
just like the whole cultural stuff in Australia. 
I: What is it about Australian culture that you really like? 

C: Um they, I'm not really sure I just like 
the like the ani mals I like kangaroos and stuff 
and I like they've got good surfing there and their cricket team's really good. 
I: Right and you've also got the word ‚chea
ting' as well as the English flag there, what 
does the word cheating represent? 
C: Well um, um, I'm not really sure why I put
 that there I just, um, yeah I don't know 
why I put that there. 
I: So let's move on to// 

C: //yeah I play the guitar and um, and yeah I 
just put that there for musician. I'm into 
rock, heavy rock, I like playi
ng it like, like Green Day. 
I: What is it about Green Day that you like? 

C: I just think the songs that they do and how they do it are good and stuff like, it's like 
rocky style but yeah, I just like the loudness of it and how it is. 
I: And what do you think about the members of Green Day? 

C: I see them like, I look up to them because they've done something with their life 
that's special and stuff and like, like they 
are very big stars and that's going into like 
my musician style, I really like the band 
so I'm going to be a rock musician too. 
I: OK so let's move on to how you th ink other people see you// 

C: //yeah// 

I: //now you've just got the word ‚chatty' there, why have you just used that word? 
C: Well I've used chatty, I'm always talki
ng and stuff and I'm really friendly and stuff 
so I just like chatty, I talk a lot usually to my friends. 
I: So do you think there's a difference between how you see yourself and how you think 
other people see you? 
C: I don't think so really I just, um, no I don't think so at all, the way other people see 
me is// 
I: //the same// 
C: //yeah. 

I: And just finally how would y
ou usually describe y our ethnicity ? 
C: English. 

I: English. Do you always say English? 
C: Yes. 
I: Do you ever say British? 



 
407
C: No 'cause most of my family, like I ha
ve a few other relatives in like Scotland and 
Ireland and stuff but I'm mainly English so
, but it depends in what way I'm British 
like my parents are fro m England so that's how I see my self. 
I: Right OK, brilliant.",15821,53,53.0,"Self-Perception, Others' Perception, Cultural Identity, Fashion and Personal Style, Emotional Expression, Hobbies and Interests, Familial Relationships, Self-Identity Conflict, Emotional Complexity, Perception by Others, Interest in Music and Pop Culture, Youth and Image, Sports Enthusiasm, Animal Representation, Self-Identity and Expression, Disconnection from Cultural Expectations",1,0,0,0,0,0,1,0,1,1,1,0,0,0,1,0,0,1,0,0,1,0,0,0,1,0,0,0,1,1,0,0,0,0,1,1,1,0,1,1
